{
  "schemaVersion": 1,
  "id": "CANVAS-KG4B",
  "title": "Interactive tiled canvas mode",
  "area": "CANVAS",
  "status": "planned",
  "summary": "Add a View-menu Tiled Mode that previews repeated copies of the active canvas and maps drawing on any copy back to the shared source artwork.",
  "createdAt": "2026-09-07T04:32:37.069Z",
  "updatedAt": "2026-09-07T06:29:09.590Z",
  "clarification": {
    "questions": [
      {
        "question": "Did 9×9 mean 81 copies or a 3×3 grid totaling nine?",
        "answer": "Three canvases per row and column.",
        "decision": "Default to 3 columns by 3 rows, totaling nine copies."
      },
      {
        "question": "Are copies passive or interactive with source-edge wrapping?",
        "answer": "Use interactive wraparound editing.",
        "decision": "Map supported tool input on any copy to one source with positive modulo coordinates."
      },
      {
        "question": "Which tools may operate through surrounding copies?",
        "answer": "Use the recommended drawing tools.",
        "decision": "Support pencil, eraser, mirror, dither, line, rectangle, circle, fill, and picker everywhere; restrict selection transforms to the source tile."
      },
      {
        "question": "How is tile count configured and persisted?",
        "answer": "Use the proposed settings contract.",
        "decision": "Provide independent 2–9 axes, 2×2/3×3/5×5 presets, device persistence, and a warning above 5 on either axis."
      },
      {
        "question": "Which platforms and adjacent view/export behavior are included?",
        "answer": "All platforms; accept the proposed boundaries.",
        "decision": "Support desktop, tablet, and phone; repeat grid/checker/onion skin, keep Live Preview singular, and leave exports/project data unchanged."
      }
    ],
    "openQuestions": []
  },
  "dependencies": [
    {
      "id": "VIEW-R7CR",
      "type": "advisory",
      "reason": "Completed shared View-menu architecture is the command surface for Tiled Mode on desktop and touch."
    }
  ],
  "affectedFiles": [
    "apps/studio/app/components/ApplicationMenu.vue",
    "apps/studio/app/components/TiledModeDialog.vue",
    "apps/studio/app/components/PixelCanvas.vue",
    "apps/studio/app/composables/useTiledMode.ts",
    "apps/studio/app/pages/index.vue",
    "apps/studio/app/composables/useEditor.ts",
    "apps/studio/app/utils/raster.ts",
    "apps/studio/app/utils/render.ts",
    "apps/studio/app/assets/css/main.css",
    "apps/studio/tests/e2e/studio.spec.ts",
    "apps/studio/tests/e2e/responsive.spec.ts",
    "apps/studio/tests/unit/raster.test.ts",
    "apps/studio/tests/unit/render.test.ts",
    "apps/studio/tests/e2e/studio.spec.ts-snapshots/studio-workbench.png",
    "apps/studio/tests/e2e/responsive.spec.ts-snapshots/phone-workbench.png",
    "apps/studio/tests/e2e/responsive.spec.ts-snapshots/tablet-workbench.png",
    "docs/ui-snapshots/studio-workbench.png",
    "docs/project-workspace.md",
    "docs/qa.md"
  ],
  "risks": [
    "Naively recomposing, cloning, or mutating once per visual copy could reintroduce severe large-canvas drawing lag.",
    "Pointer, brush, mirror, dither, and shape coordinates can wrap incorrectly at negative edges, corners, zoom levels, or non-center copies.",
    "A separate shape-preview path can disagree with samples committed at a wrapped seam.",
    "Selection transforms on repeated copies could corrupt source pixels if source-tile gating happens after state mutation.",
    "Repeated-surface resize can shift wheel, pinch, fit, or hand-pan focus unexpectedly.",
    "Large configurable grids can overflow or become unusable on phone and tablet layouts.",
    "Preference hydration races could overwrite saved values, dirty projects, or leak presentation state into files and exports.",
    "A continuous CSS checker phase or flattened composite can make repeated copies differ in checker, onion, or opacity presentation."
  ],
  "validation": [
    "Unit-test positive modulo, layout/source-tile selection, display mapping, brush expansion, and wrapped/deduplicated raster samples across negative coordinates, all edges, and corners.",
    "Playwright-test shared View commands, editor-only Shift+T versus Dither, 3×3 default rendering, every supported tool, seam preview/commit equality, one-step undo, source-only selection, settings validation, persistence, and dirty/export neutrality.",
    "Verify checkerboard, grid, onion skin, opacity, and one singular Live Preview repeat or remain independent according to the specification.",
    "Run desktop, 412×839 phone, 820×1180 tablet, and phone-landscape interaction and full-size snapshot QA for menu/dialog bounds, touch input, zoom focus, fit, hand pan, safe areas, and custom scrollbars.",
    "Instrument a representative 120×120 default tiled stroke to verify one scheduled source composition per frame, bounded blits, no pointer-time canvas resize, and no per-tile editor mutation, project clone, or pixel traversal.",
    "Run studio lint, typecheck, unit tests, static build, full Playwright suite, spec validation, Prettier, and git diff checks."
  ],
  "validationEvidence": [],
  "overrides": []
}
